{
  "project_id": "business-modeling-for-knowledge-engineer",
  "derived_from_seq": 16,
  "status": "active",
  "cursor": {
    "unit_id": "lesson-00"
  },
  "units": [
    {
      "id": "lesson-00",
      "title": "00｜为什么你需要学习业务建模？-如何落地业务建模-极客时间",
      "source_path": "content/Knowledge/Sources/如何落地业务建模/00｜为什么你需要学习业务建模？-如何落地业务建模-极客时间.md",
      "locator": null,
      "coverage": "unread",
      "expression_status": "not_requested",
      "expression_refs": [],
      "evidence_status": "not_requested",
      "evidence_refs": [],
      "open_questions": [],
      "updated_at": null
    },
    {
      "id": "lesson-01",
      "title": "01｜领域驱动设计到底在讲什么？-如何落地业务建模-极客时间",
      "source_path": "content/Knowledge/Sources/如何落地业务建模/01｜领域驱动设计到底在讲什么？-如何落地业务建模-极客时间.md",
      "locator": null,
      "coverage": "unread",
      "expression_status": "not_requested",
      "expression_refs": [],
      "evidence_status": "not_requested",
      "evidence_refs": [],
      "open_questions": [],
      "updated_at": null
    },
    {
      "id": "lesson-02",
      "title": "02｜统一语言是必要的吗？-如何落地业务建模-极客时间",
      "source_path": "content/Knowledge/Sources/如何落地业务建模/02｜统一语言是必要的吗？-如何落地业务建模-极客时间.md",
      "locator": null,
      "coverage": "unread",
      "expression_status": "not_requested",
      "expression_refs": [],
      "evidence_status": "not_requested",
      "evidence_refs": [],
      "open_questions": [],
      "updated_at": null
    },
    {
      "id": "lesson-03",
      "title": "03｜我们要怎么理解领域驱动设计？-如何落地业务建模-极客时间",
      "source_path": "content/Knowledge/Sources/如何落地业务建模/03｜我们要怎么理解领域驱动设计？-如何落地业务建模-极客时间.md",
      "locator": null,
      "coverage": "unread",
      "expression_status": "not_requested",
      "expression_refs": [],
      "evidence_status": "not_requested",
      "evidence_refs": [],
      "open_questions": [],
      "updated_at": null
    },
    {
      "id": "lesson-04",
      "title": "04｜跨越现实的障碍（上）：要性能还是要模型？-如何落地业务建模-极客时间",
      "source_path": "content/Knowledge/Sources/如何落地业务建模/04｜跨越现实的障碍（上）：要性能还是要模型？-如何落地业务建模-极客时间.md",
      "locator": null,
      "coverage": "read",
      "expression_status": "qualified",
      "expression_refs": [
        {
          "type": "file",
          "path": ".learning/projects/business-modeling-for-knowledge-engineer/sessions/20260902000540-lesson-04-expression.md",
          "locator": null
        },
        {
          "type": "file",
          "path": ".learning/projects/business-modeling-for-knowledge-engineer/sessions/20260902001559-lesson-04-expression.md",
          "locator": null
        }
      ],
      "evidence_status": "supported_with_boundary",
      "evidence_refs": [
        {
          "type": "file",
          "path": ".learning/projects/business-modeling-for-knowledge-engineer/sessions/20260902000540-lesson-04-expression.md",
          "locator": "## 用户原始表达"
        },
        {
          "type": "file",
          "path": ".learning/projects/business-modeling-for-knowledge-engineer/sessions/20260902001559-lesson-04-expression.md",
          "locator": "## 用户原始表达"
        },
        {
          "type": "file",
          "path": "content/Knowledge/Sources/如何落地业务建模/04｜跨越现实的障碍（上）：要性能还是要模型？-如何落地业务建模-极客时间.md",
          "locator": "## 无法封装的数据库开销 > ### 集合遍历与 N+1"
        },
        {
          "type": "file",
          "path": "content/Knowledge/Sources/如何落地业务建模/04｜跨越现实的障碍（上）：要性能还是要模型？-如何落地业务建模-极客时间.md",
          "locator": "### Smalltalk 中集合与数据库是等价的"
        },
        {
          "type": "file",
          "path": "content/Knowledge/Sources/如何落地业务建模/04｜跨越现实的障碍（上）：要性能还是要模型？-如何落地业务建模-极客时间.md",
          "locator": "### 多层架构彻底割裂了集合与数据库"
        },
        {
          "type": "file",
          "path": "content/Knowledge/Sources/如何落地业务建模/04｜跨越现实的障碍（上）：要性能还是要模型？-如何落地业务建模-极客时间.md",
          "locator": "## 关联对象 > ### 使用关联对象实现聚合关系"
        },
        {
          "type": "file",
          "path": "content/Knowledge/Sources/如何落地业务建模/04｜跨越现实的障碍（上）：要性能还是要模型？-如何落地业务建模-极客时间.md",
          "locator": "## 关联对象 > ### 隔离技术实现细节与领域逻辑"
        }
      ],
      "open_questions": [],
      "updated_at": "2026-09-02T00:21:43Z"
    },
    {
      "id": "lesson-05",
      "title": "05｜跨越现实的障碍（中）：富含知识还是代码坏味道？-如何落地业务建模-极客时间",
      "source_path": "content/Knowledge/Sources/如何落地业务建模/05｜跨越现实的障碍（中）：富含知识还是代码坏味道？-如何落地业务建模-极客时间.md",
      "locator": null,
      "coverage": "unread",
      "expression_status": "not_requested",
      "expression_refs": [],
      "evidence_status": "not_requested",
      "evidence_refs": [],
      "open_questions": [],
      "updated_at": null
    },
    {
      "id": "lesson-06",
      "title": "06｜跨越现实的障碍（下）：架构分层就对了吗？-如何落地业务建模-极客时间",
      "source_path": "content/Knowledge/Sources/如何落地业务建模/06｜跨越现实的障碍（下）：架构分层就对了吗？-如何落地业务建模-极客时间.md",
      "locator": null,
      "coverage": "unread",
      "expression_status": "not_requested",
      "expression_refs": [],
      "evidence_status": "not_requested",
      "evidence_refs": [],
      "open_questions": [],
      "updated_at": null
    },
    {
      "id": "lesson-07",
      "title": "07｜统一语言可以是领域模型本身吗？-如何落地业务建模-极客时间",
      "source_path": "content/Knowledge/Sources/如何落地业务建模/07｜统一语言可以是领域模型本身吗？-如何落地业务建模-极客时间.md",
      "locator": null,
      "coverage": "read",
      "expression_status": "not_requested",
      "expression_refs": [],
      "evidence_status": "not_requested",
      "evidence_refs": [],
      "open_questions": [],
      "updated_at": "2026-08-30T13:47:57Z"
    },
    {
      "id": "lesson-08",
      "title": "08｜ 什么办法可以在讨论中自然形成统一语言？-如何落地业务建模-极客时间",
      "source_path": "content/Knowledge/Sources/如何落地业务建模/08｜ 什么办法可以在讨论中自然形成统一语言？-如何落地业务建模-极客时间.md",
      "locator": null,
      "coverage": "read",
      "expression_status": "not_requested",
      "expression_refs": [],
      "evidence_status": "not_requested",
      "evidence_refs": [],
      "open_questions": [],
      "updated_at": "2026-08-30T13:47:57Z"
    },
    {
      "id": "lesson-09",
      "title": "09｜怎么才能更有效地获得事件流？-如何落地业务建模-极客时间",
      "source_path": "content/Knowledge/Sources/如何落地业务建模/09｜怎么才能更有效地获得事件流？-如何落地业务建模-极客时间.md",
      "locator": null,
      "coverage": "read",
      "expression_status": "not_requested",
      "expression_refs": [],
      "evidence_status": "not_requested",
      "evidence_refs": [],
      "open_questions": [],
      "updated_at": "2026-08-30T13:47:57Z"
    },
    {
      "id": "lesson-10",
      "title": "10｜将模型实现为RESTful API（上）-如何落地业务建模-极客时间",
      "source_path": "content/Knowledge/Sources/如何落地业务建模/10｜将模型实现为RESTful API（上）-如何落地业务建模-极客时间.md",
      "locator": null,
      "coverage": "unread",
      "expression_status": "not_requested",
      "expression_refs": [],
      "evidence_status": "not_requested",
      "evidence_refs": [],
      "open_questions": [],
      "updated_at": null
    },
    {
      "id": "lesson-11",
      "title": "11｜将模型实现为RESTful API（下）-如何落地业务建模-极客时间",
      "source_path": "content/Knowledge/Sources/如何落地业务建模/11｜将模型实现为RESTful API（下）-如何落地业务建模-极客时间.md",
      "locator": null,
      "coverage": "unread",
      "expression_status": "not_requested",
      "expression_refs": [],
      "evidence_status": "not_requested",
      "evidence_refs": [],
      "open_questions": [],
      "updated_at": null
    },
    {
      "id": "lesson-12",
      "title": "12｜云时代的挑战（上）：弹性边界还是业务边界？-如何落地业务建模-极客时间",
      "source_path": "content/Knowledge/Sources/如何落地业务建模/12｜云时代的挑战（上）：弹性边界还是业务边界？-如何落地业务建模-极客时间.md",
      "locator": null,
      "coverage": "unread",
      "expression_status": "not_requested",
      "expression_refs": [],
      "evidence_status": "not_requested",
      "evidence_refs": [],
      "open_questions": [],
      "updated_at": null
    },
    {
      "id": "lesson-13",
      "title": "13｜云时代的挑战（下）：如何保持弹性边界的独立性？-如何落地业务建模-极客时间",
      "source_path": "content/Knowledge/Sources/如何落地业务建模/13｜云时代的挑战（下）：如何保持弹性边界的独立性？-如何落地业务建模-极客时间.md",
      "locator": null,
      "coverage": "unread",
      "expression_status": "not_requested",
      "expression_refs": [],
      "evidence_status": "not_requested",
      "evidence_refs": [],
      "open_questions": [],
      "updated_at": null
    },
    {
      "id": "lesson-14",
      "title": "14｜8X Flow（上）：何为业务？何为领域？-如何落地业务建模-极客时间",
      "source_path": "content/Knowledge/Sources/如何落地业务建模/14｜8X Flow（上）：何为业务？何为领域？-如何落地业务建模-极客时间.md",
      "locator": null,
      "coverage": "read",
      "expression_status": "not_requested",
      "expression_refs": [],
      "evidence_status": "not_requested",
      "evidence_refs": [],
      "open_questions": [],
      "updated_at": "2026-08-30T13:47:57Z"
    },
    {
      "id": "lesson-15",
      "title": "15｜8X Flow（中）：如何通过模型发现业务系统的变化点？-如何落地业务建模-极客时间",
      "source_path": "content/Knowledge/Sources/如何落地业务建模/15｜8X Flow（中）：如何通过模型发现业务系统的变化点？-如何落地业务建模-极客时间.md",
      "locator": null,
      "coverage": "read",
      "expression_status": "not_requested",
      "expression_refs": [],
      "evidence_status": "not_requested",
      "evidence_refs": [],
      "open_questions": [],
      "updated_at": "2026-08-30T13:47:57Z"
    },
    {
      "id": "lesson-16",
      "title": "16｜8X Flow（下）：多于一个例子-如何落地业务建模-极客时间",
      "source_path": "content/Knowledge/Sources/如何落地业务建模/16｜8X Flow（下）：多于一个例子-如何落地业务建模-极客时间.md",
      "locator": null,
      "coverage": "read",
      "expression_status": "not_requested",
      "expression_refs": [],
      "evidence_status": "not_requested",
      "evidence_refs": [],
      "open_questions": [],
      "updated_at": "2026-08-30T13:47:57Z"
    },
    {
      "id": "lesson-17",
      "title": "17｜中台建模（上）：到底什么是中台？-如何落地业务建模-极客时间",
      "source_path": "content/Knowledge/Sources/如何落地业务建模/17｜中台建模（上）：到底什么是中台？-如何落地业务建模-极客时间.md",
      "locator": null,
      "coverage": "unread",
      "expression_status": "not_requested",
      "expression_refs": [],
      "evidence_status": "not_requested",
      "evidence_refs": [],
      "open_questions": [],
      "updated_at": null
    },
    {
      "id": "lesson-18",